<?xml version="1.0" encoding="UTF-8"?>

<contacts xmlns:xsi="http://www.w3.org/2001/XMLSchema-instance"
    xsi:noNamespaceSchemaLocation="contacts.xsd">
  <contact cid="1">
    <name>Jan</name>
    <surname>Novák</surname>
    <info>
      <address>
        <street>Skorkovského</street>
        <number>několik</number>
        <city>Brno</city>
      </address>
      <emails>
        <email>jan.novak@gmail.com</email>
        <email>novak.jan@gmail.com</email>
      </emails>
      <phones>
        <phone>123456789</phone>
      </phones>
    </info>
  </contact>
  <contact cid="2">
    <name>Pavel</name>
    <surname>Novotný</surname>
    <info>
      <address>
        <street>Kaštanová</street>
        <number>3</number>
        <city>Brno</city>
      </address>
      <emails>
        <email>pavel.novotny@gmail.com</email>
        <email>novotny.pavel@gmail.com</email>
      </emails>
      <phones>
        <phone>987645321</phone>
      </phones>
    </info>
  </contact>
  <contact cid="3">
    <name>Kamila</name>
    <surname>Nová</surname>
    <info>
    </info>
  </contact>
</contacts>
